{
  "checks": [
    {
      "command": "python scripts/generate_track_artifacts.py",
      "exit_code": 0,
      "input_version": "e8c0533775f1ab69ceaecfd9de3933012a4f961d6df6df4653ac85f20b6c97b9",
      "name": "bounded-domain-evaluator",
      "output_path": "artifacts/t2-causal/sample-run.json",
      "recorded_at": "2026-09-27T06:35:08.159947+00:00"
    },
    {
      "command": "python scripts/generate_track_artifacts.py",
      "exit_code": 0,
      "input_version": "0971a9036e84aa5a2f0fe25749641850b3a623794acbf818d0c0520da8f6e798",
      "name": "physical-counterfactual-subtrack",
      "output_path": "artifacts/t2-physical/acceptance.json",
      "recorded_at": "2026-09-27T06:35:08.273275+00:00"
    }
  ],
  "evaluator": {
    "blocked_gates": [
      "real-world intervention data and causal identification"
    ],
    "evaluator_id": "causal-intervention-v1",
    "evidence_files": [
      {
        "allowed_use": [
          "offline-fixture",
          "bounded-evaluator"
        ],
        "bytes": 535,
        "path": "examples/causal/fixture.json",
        "provenance_status": "unverified",
        "sha256": "e3541bc14cc16836f1f1fff989a37743904387596712b82f323f12dc5778ab15"
      }
    ],
    "evidence_level": "validated-reproduction",
    "input_hash": "e8c0533775f1ab69ceaecfd9de3933012a4f961d6df6df4653ac85f20b6c97b9",
    "negative_case_passed": true,
    "passed": true,
    "result": {
      "coefficient": 2.0,
      "evaluator_id": "causal-intervention-v1",
      "holdout_rmse": 0.0,
      "intercept": 1.0,
      "max_context_invariance_error": 0.0,
      "negative_candidate_rejected": true,
      "notes": [
        "Intervention outcome uses do(x=value); context_value is intentionally ignored.",
        "Negative candidate is required to fail the holdout gate."
      ],
      "passed": true,
      "train_rmse": 0.0
    },
    "source_files": [
      {
        "allowed_use": [
          "offline-evaluator",
          "source-provenance"
        ],
        "bytes": 3268,
        "path": "src/auditable_scientist/tracks/causal.py",
        "provenance_status": "unverified",
        "sha256": "f35d397499777edfab301198824daa9066c8b1f6a18eb10faceba82520c6acb4"
      },
      {
        "allowed_use": [
          "offline-evaluator",
          "source-provenance"
        ],
        "bytes": 1933,
        "path": "src/auditable_scientist/tracks/common.py",
        "provenance_status": "unverified",
        "sha256": "ef149ee4a1779bb14d5b3555832b20452a75c2d55d5d844c386860b3e207cb75"
      },
      {
        "allowed_use": [
          "offline-evaluator",
          "source-provenance"
        ],
        "bytes": 8402,
        "path": "src/auditable_scientist/tracks/run_package.py",
        "provenance_status": "unverified",
        "sha256": "ec2fa3ca7bf43534895e9925a4aedfdeedde8e219117596f5aa355473a0a10dc"
      },
      {
        "allowed_use": [
          "offline-evaluator",
          "source-provenance"
        ],
        "bytes": 11176,
        "path": "src/auditable_scientist/tracks/runner.py",
        "provenance_status": "unverified",
        "sha256": "af3f27a8fb9a8a51acc9d71aed710245dd2cf417166c11d7bf1ff4fb631e9114"
      },
      {
        "allowed_use": [
          "offline-evaluator",
          "source-provenance"
        ],
        "bytes": 11495,
        "path": "src/auditable_scientist/domain/models.py",
        "provenance_status": "unverified",
        "sha256": "600675265af4459fef988fc9e5c7c3a56182f51302fa2acaf04566593c919b8e"
      },
      {
        "allowed_use": [
          "offline-evaluator",
          "source-provenance"
        ],
        "bytes": 5093,
        "path": "src/auditable_scientist/policy/runtime.py",
        "provenance_status": "unverified",
        "sha256": "69fc8728f1d48d6910b13d12c4faccbd184798b3fd211daffe668d49036ab648"
      },
      {
        "allowed_use": [
          "offline-evaluator",
          "source-provenance"
        ],
        "bytes": 1432,
        "path": "src/auditable_scientist/runtime/canonical.py",
        "provenance_status": "unverified",
        "sha256": "e64387beca6fc1eaafa586a4531706df0cc7fe326274d2cab087d6286871673f"
      },
      {
        "allowed_use": [
          "offline-evaluator",
          "source-provenance"
        ],
        "bytes": 829,
        "path": "src/auditable_scientist/runtime/environment.py",
        "provenance_status": "unverified",
        "sha256": "8fcc0e2909ca3e47d266c4f6c3d08be66b0d91346094555c1f46653c758b3bb1"
      },
      {
        "allowed_use": [
          "offline-evaluator",
          "source-provenance"
        ],
        "bytes": 2790,
        "path": "src/auditable_scientist/runtime/event_log.py",
        "provenance_status": "unverified",
        "sha256": "28202fa27d78dfedd4f7c60cee6d9449ff6da37c3e9dd27d3e0547860d2e6807"
      },
      {
        "allowed_use": [
          "offline-evaluator",
          "source-provenance"
        ],
        "bytes": 7943,
        "path": "src/auditable_scientist/runtime/replay.py",
        "provenance_status": "unverified",
        "sha256": "106567264c0f85394aab36434af0713f79b88cd29827e1a5af1c26d3f889f274"
      },
      {
        "allowed_use": [
          "offline-evaluator",
          "source-provenance"
        ],
        "bytes": 2116,
        "path": "src/auditable_scientist/runtime/run_integrity.py",
        "provenance_status": "unverified",
        "sha256": "187c1012979b9236038ee057591269d2e702ee51295914caf804873d1136cb9b"
      },
      {
        "allowed_use": [
          "offline-evaluator",
          "source-provenance"
        ],
        "bytes": 1651,
        "path": "src/auditable_scientist/runtime/paths.py",
        "provenance_status": "unverified",
        "sha256": "362ba1810c52a46d6c06138c3f1552ef90b0adc3ac95d8d7887eaf5a5d48fa76"
      },
      {
        "allowed_use": [
          "offline-evaluator",
          "source-provenance"
        ],
        "bytes": 25103,
        "path": "src/auditable_scientist/cli.py",
        "provenance_status": "unverified",
        "sha256": "910547c4b746ddfff20adca42e1a242bafca78b3c981524708d8bf5deddf4365"
      },
      {
        "allowed_use": [
          "offline-evaluator",
          "source-provenance"
        ],
        "bytes": 8820,
        "path": "src/auditable_scientist/track_cli.py",
        "provenance_status": "unverified",
        "sha256": "a8d0886d912428d2868cabdaca8cb4a96f118f0e3db506272b529d961d04740b"
      },
      {
        "allowed_use": [
          "offline-evaluator",
          "source-provenance"
        ],
        "bytes": 21807,
        "path": "scripts/generate_track_artifacts.py",
        "provenance_status": "unverified",
        "sha256": "7a015a09ab27361703b76d5e016378d03f7d00667c665e6f21040cbe0af04cb3"
      },
      {
        "allowed_use": [
          "offline-evaluator",
          "source-provenance"
        ],
        "bytes": 792,
        "path": "pyproject.toml",
        "provenance_status": "unverified",
        "sha256": "ac81f666d36c3bc904f5b91cb585713abc6597c85b5749e99a99440d24ac67b1"
      },
      {
        "allowed_use": [
          "offline-evaluator",
          "source-provenance"
        ],
        "bytes": 1318,
        "path": "docs/EVIDENCE_POLICY.md",
        "provenance_status": "unverified",
        "sha256": "dc82def315d527881b863b6a3b34f7b268db87ace460baa5efd572c613978639"
      },
      {
        "allowed_use": [
          "offline-evaluator",
          "source-provenance"
        ],
        "bytes": 508,
        "path": "schemas/track-tool-call-v1.json",
        "provenance_status": "unverified",
        "sha256": "e03a3f22059a56ce5609482ba7445238b18fa1d6c2a1ee32b955403e53410dd1"
      },
      {
        "allowed_use": [
          "offline-evaluator",
          "source-provenance"
        ],
        "bytes": 1740,
        "path": "schemas/track-receipt-v1.json",
        "provenance_status": "unverified",
        "sha256": "152c1f70a20d6a62b1746aa2c4a6330eca4e47de10cf27ed4a49d59687d743a4"
      },
      {
        "allowed_use": [
          "offline-evaluator",
          "source-provenance"
        ],
        "bytes": 3260,
        "path": "schemas/track-acceptance-v1.json",
        "provenance_status": "unverified",
        "sha256": "88e7302f377e60b1c69e6a022b8a3d650c8359f3d05dd6de7613af7660a258d7"
      },
      {
        "allowed_use": [
          "offline-evaluator",
          "source-provenance"
        ],
        "bytes": 8072,
        "path": "schemas/run.schema.json",
        "provenance_status": "unverified",
        "sha256": "aa3866541edf9df7193c0569572aae8dd607aa5566717790802851f431ace3dc"
      }
    ],
    "track_id": "T2"
  },
  "evidence_boundaries": {
    "demo": true,
    "real_data": false,
    "research_candidate": false,
    "validated_reproduction": true
  },
  "execution": "offline",
  "negative_case": {
    "rejected": true,
    "wrong_coefficient": 1.0
  },
  "status": "accepted-with-bounded-scope",
  "track": "T2"
}
